{
  "diagnostics": [
    {
      "cell": null,
      "cell_line": null,
      "code": "ALG001",
      "col": 1,
      "detail": "left - right = 2*a*b",
      "end_col": 19,
      "end_line": 3,
      "equation": "(a+b)^2 = a^2 + b^2",
      "hint": null,
      "line": 3,
      "message": "algebraic identity does not hold",
      "path": "tests/fixtures/bad/suppressed_bad.md",
      "severity": "error",
      "suppressed": true,
      "suppression_reason": "source comment"
    }
  ],
  "schema_version": "0.1",
  "summary": {
    "errors": 0,
    "files_checked": 1,
    "info": 0,
    "math_blocks_checked": 1,
    "warnings": 0
  },
  "tool": "scieqlint",
  "version": "1.2.2"
}
